{
  "request_id": "req-1945-0001",
  "action": "accept",
  "target_country_tag": "ENG",
  "message": "We accept these terms and will proceed immediately.",
  "confidence": 0.92,
  "reason_codes": [
    "high_alignment",
    "favorable_frontline"
  ],
  "cooldown_hint_days": 2,
  "requires_human_visible_event": false,
  "metadata": {
    "priority": 1,
    "trace_id": "trace-abc123"
  }
}
